"No.","Time","Source","Destination","Protocol","Length","Info"
"1","0.000000","TendaTec_96:04:00","HonHaiPr_c0:15:9b","ARP","60","Who has 192.168.0.175? Tell 192.168.0.1"
"2","0.000016","HonHaiPr_c0:15:9b","TendaTec_96:04:00","ARP","42","192.168.0.175 is at 70:77:81:c0:15:9b"
"3","6.034862","148.251.69.85","192.168.0.175","TCP","54","80  >  59552 [ACK] Seq=1 Ack=1 Win=501 Len=0"
"4","6.034927","192.168.0.175","148.251.69.85","TCP","54","[TCP ACKed unseen segment] 59552  >  80 [ACK] Seq=1 Ack=2 Win=516 Len=0"
"5","8.417345","3.232.144.130","192.168.0.175","TCP","56","443  >  59506 [ACK] Seq=1 Ack=1 Win=8 Len=0"
"6","8.417390","192.168.0.175","3.232.144.130","TCP","54","[TCP ACKed unseen segment] 59506  >  443 [ACK] Seq=1 Ack=2 Win=515 Len=0"
"7","10.752452","192.168.0.175","148.251.69.85","TCP","109","[TCP ACKed unseen segment] 59552  >  80 [PSH, ACK] Seq=1 Ack=2 Win=516 Len=55"
"8","10.938858","148.251.69.85","192.168.0.175","TCP","104","[TCP Previous segment not captured] 80  >  59552 [PSH, ACK] Seq=2 Ack=56 Win=501 Len=50"
"9","10.986716","192.168.0.175","148.251.69.85","TCP","54","[TCP ACKed unseen segment] 59552  >  80 [ACK] Seq=56 Ack=52 Win=516 Len=0"
"10","11.009959","TendaTec_96:04:00","HonHaiPr_c0:15:9b","ARP","60","Who has 192.168.0.175? Tell 192.168.0.1"
"11","11.009976","HonHaiPr_c0:15:9b","TendaTec_96:04:00","ARP","42","192.168.0.175 is at 70:77:81:c0:15:9b"
"12","12.133736","3.232.144.130","192.168.0.175","TCP","56","443  >  59504 [ACK] Seq=1 Ack=1 Win=8 Len=0"
"13","12.133776","192.168.0.175","3.232.144.130","TCP","54","[TCP ACKed unseen segment] 59504  >  443 [ACK] Seq=1 Ack=2 Win=515 Len=0"
"14","20.689467","192.168.0.175","40.90.189.152","TLSv1.2","155","Application Data"
"15","20.732321","40.90.189.152","192.168.0.175","TLSv1.2","225","Application Data"
"16","20.782837","192.168.0.175","40.90.189.152","TCP","54","53833  >  443 [ACK] Seq=102 Ack=172 Win=515 Len=0"
"17","20.970424","192.168.0.175","52.28.169.234","TLSv1","144","Application Data, Application Data"
"18","21.103522","52.28.169.234","192.168.0.175","TLSv1","91","Encrypted Alert"
"19","21.103522","52.28.169.234","192.168.0.175","TCP","54","443  >  53853 [FIN, ACK] Seq=38 Ack=1 Win=118 Len=0"
"20","21.103596","192.168.0.175","52.28.169.234","TCP","54","53853  >  443 [ACK] Seq=91 Ack=39 Win=517 Len=0"
"21","21.103853","192.168.0.175","52.28.169.234","TCP","54","53853  >  443 [FIN, ACK] Seq=91 Ack=39 Win=517 Len=0"
"22","21.157411","52.28.169.234","192.168.0.175","TCP","54","443  >  53853 [ACK] Seq=39 Ack=91 Win=118 Len=0"
"23","21.250343","52.28.169.234","192.168.0.175","TCP","54","443  >  53853 [ACK] Seq=39 Ack=92 Win=118 Len=0"
"24","21.300987","192.168.0.175","255.255.255.255","UDP","82","49669  >  1947 Len=40"
"25","21.393476","148.251.69.85","192.168.0.175","TCP","54","[TCP Keep-Alive] 80  >  59552 [ACK] Seq=51 Ack=56 Win=501 Len=0"
"26","21.393517","192.168.0.175","148.251.69.85","TCP","54","[TCP Keep-Alive ACK] 59552  >  80 [ACK] Seq=56 Ack=52 Win=516 Len=0"
"27","21.665547","192.168.0.1","239.255.255.250","SSDP","278","NOTIFY * HTTP/1.1 "
"28","21.665977","192.168.0.1","239.255.255.250","SSDP","350","NOTIFY * HTTP/1.1 "
"29","21.666580","192.168.0.1","239.255.255.250","SSDP","346","NOTIFY * HTTP/1.1 "
"30","21.667006","192.168.0.1","239.255.255.250","SSDP","326","NOTIFY * HTTP/1.1 "
"31","21.667640","192.168.0.1","239.255.255.250","SSDP","358","NOTIFY * HTTP/1.1 "
"32","21.668061","192.168.0.1","239.255.255.250","SSDP","340","NOTIFY * HTTP/1.1 "
"33","21.668694","192.168.0.1","239.255.255.250","SSDP","342","NOTIFY * HTTP/1.1 "
"34","21.669111","192.168.0.1","239.255.255.250","SSDP","342","NOTIFY * HTTP/1.1 "
"35","22.019839","TendaTec_96:04:00","HonHaiPr_c0:15:9b","ARP","60","Who has 192.168.0.175? Tell 192.168.0.1"
"36","22.019856","HonHaiPr_c0:15:9b","TendaTec_96:04:00","ARP","42","192.168.0.175 is at 70:77:81:c0:15:9b"
"37","25.329400","192.168.0.175","192.168.0.255","UDP","82","49669  >  1947 Len=40"
"38","25.954309","192.168.0.175","148.251.69.85","TCP","109","59552  >  80 [PSH, ACK] Seq=56 Ack=52 Win=516 Len=55"
"39","26.143410","148.251.69.85","192.168.0.175","TCP","104","80  >  59552 [PSH, ACK] Seq=52 Ack=111 Win=501 Len=50"
"40","26.188482","192.168.0.175","148.251.69.85","TCP","54","59552  >  80 [ACK] Seq=111 Ack=102 Win=516 Len=0"
"41","28.785276","192.168.0.175","74.125.200.188","TCP","55","59594  >  5228 [ACK] Seq=1 Ack=1 Win=513 Len=1"
"42","28.827550","74.125.200.188","192.168.0.175","TCP","66","5228  >  59594 [ACK] Seq=1 Ack=2 Win=265 Len=0 SLE=1 SRE=2"
"43","29.407891","3.232.144.130","192.168.0.175","TCP","56","[TCP Dup ACK 5#1] 443  >  59506 [ACK] Seq=1 Ack=1 Win=8 Len=0"
"44","29.407931","192.168.0.175","3.232.144.130","TCP","54","[TCP Dup ACK 6#1] [TCP ACKed unseen segment] 59506  >  443 [ACK] Seq=1 Ack=2 Win=515 Len=0"
"45","31.754700","3.232.144.130","192.168.0.175","TLSv1","91","[TCP Previous segment not captured] , Application Data"
"46","31.755026","192.168.0.175","3.232.144.130","TLSv1","128","[TCP ACKed unseen segment] , Application Data, Application Data"
"47","31.984382","3.232.144.130","192.168.0.175","TCP","56","443  >  59504 [ACK] Seq=39 Ack=75 Win=8 Len=0"
"48","32.987437","3.232.144.130","192.168.0.175","TCP","56","[TCP Keep-Alive] 443  >  59504 [ACK] Seq=38 Ack=75 Win=8 Len=0"
"49","32.987481","192.168.0.175","3.232.144.130","TCP","54","[TCP Keep-Alive ACK] 59504  >  443 [ACK] Seq=75 Ack=39 Win=515 Len=0"
"50","33.031639","TendaTec_96:04:00","HonHaiPr_c0:15:9b","ARP","60","Who has 192.168.0.175? Tell 192.168.0.1"
"51","33.031656","HonHaiPr_c0:15:9b","TendaTec_96:04:00","ARP","42","192.168.0.175 is at 70:77:81:c0:15:9b"
"52","36.042961","192.168.0.175","106.51.113.2","DNS","74","Standard query 0x3f00 A www.google.com"
"53","36.044890","106.51.113.2","192.168.0.175","DNS","90","Standard query response 0x3f00 A www.google.com A 142.250.71.4"
"54","36.045814","192.168.0.175","142.250.71.4","TCP","66","53861  >  443 [SYN] Seq=0 Win=64240 Len=0 MSS=1460 WS=256 SACK_PERM=1"
"55","36.057148","142.250.71.4","192.168.0.175","TCP","66","443  >  53861 [SYN, ACK] Seq=0 Ack=1 Win=65535 Len=0 MSS=1430 SACK_PERM=1 WS=256"
"56","36.057263","192.168.0.175","142.250.71.4","TCP","54","53861  >  443 [ACK] Seq=1 Ack=1 Win=131328 Len=0"
"57","36.057730","192.168.0.175","142.250.71.4","TLSv1.3","634","Client Hello"
"58","36.069137","142.250.71.4","192.168.0.175","TCP","54","443  >  53861 [ACK] Seq=1 Ack=581 Win=66816 Len=0"
"59","36.107658","142.250.71.4","192.168.0.175","TLSv1.3","266","Server Hello, Change Cipher Spec, Application Data"
"60","36.135718","192.168.0.175","142.250.71.4","TLSv1.3","118","Change Cipher Spec, Application Data"
"61","36.137281","192.168.0.175","142.250.71.4","TLSv1.3","146","Application Data"
"62","36.138224","192.168.0.175","142.250.71.4","TLSv1.3","1402","Application Data"
"63","36.148308","142.250.71.4","192.168.0.175","TCP","54","443  >  53861 [ACK] Seq=213 Ack=737 Win=66816 Len=0"
"64","36.148308","142.250.71.4","192.168.0.175","TLSv1.3","634","Application Data, Application Data"
"65","36.148419","142.250.71.4","192.168.0.175","TLSv1.3","85","Application Data"
"66","36.148465","192.168.0.175","142.250.71.4","TCP","54","53861  >  443 [ACK] Seq=2085 Ack=824 Win=130560 Len=0"
"67","36.148679","192.168.0.175","142.250.71.4","TLSv1.3","85","Application Data"
"68","36.154351","142.250.71.4","192.168.0.175","TCP","54","443  >  53861 [ACK] Seq=824 Ack=2085 Win=69632 Len=0"
"69","36.157174","192.168.0.175","142.250.71.4","TLSv1.3","89","Application Data"
"70","36.160219","142.250.71.4","192.168.0.175","TCP","56","443  >  53861 [ACK] Seq=824 Ack=2116 Win=69632 Len=0"
"71","36.160822","192.168.0.175","74.125.200.188","TCP","54","59594  >  5228 [FIN, ACK] Seq=2 Ack=1 Win=513 Len=0"
"72","36.167913","142.250.71.4","192.168.0.175","TCP","56","443  >  53861 [ACK] Seq=824 Ack=2151 Win=69632 Len=0"
"73","36.191449","192.168.0.175","142.250.71.4","TCP","54","53861  >  443 [FIN, ACK] Seq=2151 Ack=824 Win=130560 Len=0"
"74","36.202903","142.250.71.4","192.168.0.175","TCP","54","443  >  53861 [FIN, ACK] Seq=824 Ack=2152 Win=69632 Len=0"
"75","36.203285","192.168.0.175","142.250.71.4","TCP","54","53861  >  443 [ACK] Seq=2152 Ack=825 Win=130560 Len=0"
"76","36.474996","192.168.0.175","74.125.200.188","TCP","54","[TCP Retransmission] 59594  >  5228 [FIN, ACK] Seq=2 Ack=1 Win=513 Len=0"
"77","36.498369","148.251.69.85","192.168.0.175","TCP","54","[TCP Keep-Alive] 80  >  59552 [ACK] Seq=101 Ack=111 Win=501 Len=0"
"78","36.498413","192.168.0.175","148.251.69.85","TCP","54","[TCP Keep-Alive ACK] 59552  >  80 [ACK] Seq=111 Ack=102 Win=516 Len=0"
"79","36.517360","74.125.200.188","192.168.0.175","TCP","54","5228  >  59594 [RST] Seq=1 Win=0 Len=0"
"80","39.400289","192.168.0.175","239.255.255.250","SSDP","216","M-SEARCH * HTTP/1.1 "
"81","39.517370","3.232.144.130","192.168.0.175","TLSv1","91","[TCP Previous segment not captured] , Application Data"
"82","39.517660","192.168.0.175","3.232.144.130","TLSv1","128","[TCP ACKed unseen segment] , Application Data, Application Data"
"83","39.744317","3.232.144.130","192.168.0.175","TCP","56","443  >  59506 [ACK] Seq=39 Ack=75 Win=8 Len=0"
"84","40.402019","192.168.0.175","239.255.255.250","SSDP","216","M-SEARCH * HTTP/1.1 "
"85","41.152175","192.168.0.175","148.251.69.85","TCP","109","59552  >  80 [PSH, ACK] Seq=111 Ack=102 Win=516 Len=55"
"86","41.346910","148.251.69.85","192.168.0.175","TCP","104","80  >  59552 [PSH, ACK] Seq=102 Ack=166 Win=501 Len=50"
"87","41.378054","192.168.0.175","192.168.0.255","NBNS","92","Name query NB WPAD<00>"
"88","41.378169","192.168.0.175","192.168.0.255","NBNS","92","Name query NB WPAD<00>"
"89","41.378490","192.168.0.175","224.0.0.251","MDNS","70","Standard query 0x0000 A wpad.local, ""QM"" question"
"90","41.378785","fe80::10e8:a37:a496:83f6","ff02::fb","MDNS","90","Standard query 0x0000 A wpad.local, ""QM"" question"
"91","41.379189","192.168.0.175","224.0.0.251","MDNS","70","Standard query 0x0000 A wpad.local, ""QM"" question"
"92","41.379365","fe80::10e8:a37:a496:83f6","ff02::fb","MDNS","90","Standard query 0x0000 A wpad.local, ""QM"" question"
"93","41.379428","fe80::10e8:a37:a496:83f6","ff02::1:3","LLMNR","84","Standard query 0x0e8e A wpad"
"94","41.379592","192.168.0.175","224.0.0.252","LLMNR","64","Standard query 0x0e8e A wpad"
"95","41.379748","fe80::10e8:a37:a496:83f6","ff02::1:3","LLMNR","84","Standard query 0xee95 A wpad"
"96","41.379893","192.168.0.175","224.0.0.252","LLMNR","64","Standard query 0xee95 A wpad"
"97","41.387489","192.168.0.175","148.251.69.85","TCP","54","59552  >  80 [ACK] Seq=166 Ack=152 Win=516 Len=0"
"98","41.402539","192.168.0.175","239.255.255.250","SSDP","216","M-SEARCH * HTTP/1.1 "
"99","41.799197","fe80::10e8:a37:a496:83f6","ff02::1:3","LLMNR","84","Standard query 0x0e8e A wpad"
"100","41.799219","fe80::10e8:a37:a496:83f6","ff02::1:3","LLMNR","84","Standard query 0xee95 A wpad"
"101","41.799303","192.168.0.175","224.0.0.252","LLMNR","64","Standard query 0xee95 A wpad"
"102","41.799336","192.168.0.175","224.0.0.252","LLMNR","64","Standard query 0x0e8e A wpad"
"103","42.134938","192.168.0.175","192.168.0.255","NBNS","92","Name query NB WPAD<00>"
"104","42.135043","192.168.0.175","192.168.0.255","NBNS","92","Name query NB WPAD<00>"
"105","42.380125","192.168.0.175","224.0.0.251","MDNS","70","Standard query 0x0000 A wpad.local, ""QM"" question"
"106","42.380376","fe80::10e8:a37:a496:83f6","ff02::fb","MDNS","90","Standard query 0x0000 A wpad.local, ""QM"" question"
"107","42.380734","192.168.0.175","224.0.0.251","MDNS","70","Standard query 0x0000 A wpad.local, ""QM"" question"
"108","42.381076","192.168.0.175","106.51.113.2","DNS","89","Standard query 0xc5ab A clientservices.googleapis.com"
"109","42.381110","fe80::10e8:a37:a496:83f6","ff02::fb","MDNS","90","Standard query 0x0000 A wpad.local, ""QM"" question"
"110","42.382337","192.168.0.175","106.51.113.2","DNS","79","Standard query 0x49c2 A clients2.google.com"
"111","42.382337","192.168.0.175","106.51.113.2","DNS","78","Standard query 0xb6f6 A www.googleapis.com"
"112","42.382337","192.168.0.175","106.51.113.2","DNS","79","Standard query 0x9a60 A accounts.google.com"
"113","42.383032","192.168.0.175","106.51.113.2","DNS","69","Standard query 0x50e3 A gmail.com"
"114","42.385313","192.168.0.175","142.250.71.4","TCP","66","53862  >  443 [SYN] Seq=0 Win=64240 Len=0 MSS=1460 WS=256 SACK_PERM=1"
"115","42.386012","192.168.0.175","142.250.71.4","TCP","66","53863  >  443 [SYN] Seq=0 Win=64240 Len=0 MSS=1460 WS=256 SACK_PERM=1"
"116","42.386696","106.51.113.2","192.168.0.175","DNS","105","Standard query response 0xc5ab A clientservices.googleapis.com A 172.217.163.163"
"117","42.387271","192.168.0.175","172.217.163.163","TCP","66","53864  >  443 [SYN] Seq=0 Win=64240 Len=0 MSS=1460 WS=256 SACK_PERM=1"
"118","42.396269","106.51.113.2","192.168.0.175","DNS","119","Standard query response 0x49c2 A clients2.google.com CNAME clients.l.google.com A 142.250.67.78"
"119","42.396269","106.51.113.2","192.168.0.175","DNS","95","Standard query response 0x9a60 A accounts.google.com A 216.58.200.141"
"120","42.396362","106.51.113.2","192.168.0.175","DNS","334","Standard query response 0xb6f6 A www.googleapis.com A 142.250.76.42 A 172.217.163.170 A 142.250.71.10 A 172.217.167.138 A 142.250.71.42 A 172.217.163.42 A 142.250.76.74 A 172.217.163.138 A 142.250.67.74 A 172.217.163.106 A 216.58.196.170 A 172.217.160.138 A 172.217.163.202 A 172.217.163.74 A 172.217.26.170 A 216.58.197.74"
"121","42.396472","106.51.113.2","192.168.0.175","DNS","85","Standard query response 0x50e3 A gmail.com A 172.217.163.165"
"122","42.396910","192.168.0.175","142.250.67.78","TCP","66","53865  >  443 [SYN] Seq=0 Win=64240 Len=0 MSS=1460 WS=256 SACK_PERM=1"
"123","42.397132","192.168.0.175","216.58.200.141","TCP","66","53866  >  443 [SYN] Seq=0 Win=64240 Len=0 MSS=1460 WS=256 SACK_PERM=1"
"124","42.397319","192.168.0.175","172.217.163.165","TCP","66","53867  >  443 [SYN] Seq=0 Win=64240 Len=0 MSS=1460 WS=256 SACK_PERM=1"
"125","42.397556","192.168.0.175","142.250.76.42","TCP","66","53868  >  443 [SYN] Seq=0 Win=64240 Len=0 MSS=1460 WS=256 SACK_PERM=1"
"126","42.397886","192.168.0.175","172.217.163.165","TCP","66","53869  >  443 [SYN] Seq=0 Win=64240 Len=0 MSS=1460 WS=256 SACK_PERM=1"
"127","42.403548","192.168.0.175","239.255.255.250","SSDP","216","M-SEARCH * HTTP/1.1 "
"128","42.405303","142.250.71.4","192.168.0.175","TCP","66","443  >  53862 [SYN, ACK] Seq=0 Ack=1 Win=65535 Len=0 MSS=1430 SACK_PERM=1 WS=256"
"129","42.405386","192.168.0.175","142.250.71.4","TCP","54","53862  >  443 [ACK] Seq=1 Ack=1 Win=131328 Len=0"
"130","42.405904","192.168.0.175","142.250.71.4","TLSv1.3","571","Client Hello"
"131","42.408775","142.250.71.4","192.168.0.175","TCP","66","443  >  53863 [SYN, ACK] Seq=0 Ack=1 Win=65535 Len=0 MSS=1430 SACK_PERM=1 WS=256"
"132","42.408775","172.217.163.163","192.168.0.175","TCP","66","443  >  53864 [SYN, ACK] Seq=0 Ack=1 Win=65535 Len=0 MSS=1430 SACK_PERM=1 WS=256"
"133","42.408868","192.168.0.175","142.250.71.4","TCP","54","53863  >  443 [ACK] Seq=1 Ack=1 Win=131328 Len=0"
"134","42.408932","192.168.0.175","172.217.163.163","TCP","54","53864  >  443 [ACK] Seq=1 Ack=1 Win=131328 Len=0"
"135","42.409131","192.168.0.175","172.217.163.163","TLSv1.3","571","Client Hello"
"136","42.409390","192.168.0.175","142.250.71.4","TLSv1.3","571","Client Hello"
"137","42.419134","142.250.67.78","192.168.0.175","TCP","66","443  >  53865 [SYN, ACK] Seq=0 Ack=1 Win=65535 Len=0 MSS=1430 SACK_PERM=1 WS=256"
"138","42.419134","142.250.76.42","192.168.0.175","TCP","66","443  >  53868 [SYN, ACK] Seq=0 Ack=1 Win=65535 Len=0 MSS=1430 SACK_PERM=1 WS=256"
"139","42.419237","192.168.0.175","142.250.67.78","TCP","54","53865  >  443 [ACK] Seq=1 Ack=1 Win=131328 Len=0"
"140","42.419304","192.168.0.175","142.250.76.42","TCP","54","53868  >  443 [ACK] Seq=1 Ack=1 Win=131328 Len=0"
"141","42.419351","216.58.200.141","192.168.0.175","TCP","66","443  >  53866 [SYN, ACK] Seq=0 Ack=1 Win=65535 Len=0 MSS=1430 SACK_PERM=1 WS=256"
"142","42.419351","172.217.163.165","192.168.0.175","TCP","66","443  >  53867 [SYN, ACK] Seq=0 Ack=1 Win=65535 Len=0 MSS=1430 SACK_PERM=1 WS=256"
"143","42.419351","172.217.163.165","192.168.0.175","TCP","66","443  >  53869 [SYN, ACK] Seq=0 Ack=1 Win=65535 Len=0 MSS=1430 SACK_PERM=1 WS=256"
"144","42.419451","192.168.0.175","216.58.200.141","TCP","54","53866  >  443 [ACK] Seq=1 Ack=1 Win=131328 Len=0"
"145","42.419495","192.168.0.175","172.217.163.165","TCP","54","53867  >  443 [ACK] Seq=1 Ack=1 Win=131328 Len=0"
"146","42.419522","192.168.0.175","172.217.163.165","TCP","54","53869  >  443 [ACK] Seq=1 Ack=1 Win=131328 Len=0"
"147","42.419559","192.168.0.175","142.250.76.42","TLSv1.3","571","Client Hello"
"148","42.419815","192.168.0.175","142.250.67.78","TLSv1.3","571","Client Hello"
"149","42.420017","192.168.0.175","216.58.200.141","TLSv1.3","571","Client Hello"
"150","42.420231","192.168.0.175","172.217.163.165","TLSv1.3","571","Client Hello"
"151","42.420428","192.168.0.175","172.217.163.165","TLSv1.3","571","Client Hello"
"152","42.420644","142.250.71.4","192.168.0.175","TCP","54","443  >  53862 [ACK] Seq=1 Ack=518 Win=66816 Len=0"
"153","42.421228","142.250.71.4","192.168.0.175","TCP","54","443  >  53863 [ACK] Seq=1 Ack=518 Win=66816 Len=0"
"154","42.421431","172.217.163.163","192.168.0.175","TCP","54","443  >  53864 [ACK] Seq=1 Ack=518 Win=66816 Len=0"
"155","42.430548","142.250.76.42","192.168.0.175","TCP","54","443  >  53868 [ACK] Seq=1 Ack=518 Win=66816 Len=0"
"156","42.431131","142.250.67.78","192.168.0.175","TCP","54","443  >  53865 [ACK] Seq=1 Ack=518 Win=66816 Len=0"
"157","42.431131","216.58.200.141","192.168.0.175","TCP","54","443  >  53866 [ACK] Seq=1 Ack=518 Win=66816 Len=0"
"158","42.431187","172.217.163.165","192.168.0.175","TCP","54","443  >  53867 [ACK] Seq=1 Ack=518 Win=66816 Len=0"
"159","42.431669","172.217.163.165","192.168.0.175","TCP","54","443  >  53869 [ACK] Seq=1 Ack=518 Win=66816 Len=0"
"160","42.452974","142.250.71.4","192.168.0.175","TLSv1.3","1484","Server Hello, Change Cipher Spec"
"161","42.452974","142.250.71.4","192.168.0.175","TLSv1.3","1256","Application Data"
"162","42.453067","192.168.0.175","142.250.71.4","TCP","54","53862  >  443 [ACK] Seq=518 Ack=2633 Win=131328 Len=0"
"163","42.453740","172.217.163.163","192.168.0.175","TLSv1.3","1484","Server Hello, Change Cipher Spec"
"164","42.453935","172.217.163.163","192.168.0.175","TCP","1484","443  >  53864 [ACK] Seq=1431 Ack=518 Win=66816 Len=1430 [TCP segment of a reassembled PDU]"
"165","42.453935","172.217.163.163","192.168.0.175","TLSv1.3","113","Application Data"
"166","42.453980","192.168.0.175","172.217.163.163","TCP","54","53864  >  443 [ACK] Seq=518 Ack=2920 Win=131328 Len=0"
"167","42.454156","142.250.71.4","192.168.0.175","TLSv1.3","1484","Server Hello, Change Cipher Spec"
"168","42.454156","142.250.71.4","192.168.0.175","TLSv1.3","1255","Application Data"
"169","42.454220","192.168.0.175","142.250.71.4","TCP","54","53863  >  443 [ACK] Seq=518 Ack=2632 Win=131328 Len=0"
"170","42.463439","216.58.200.141","192.168.0.175","TLSv1.3","1484","Server Hello, Change Cipher Spec"
"171","42.463439","216.58.200.141","192.168.0.175","TLSv1.3","1289","Application Data"
"172","42.463519","192.168.0.175","216.58.200.141","TCP","54","53866  >  443 [ACK] Seq=518 Ack=2666 Win=131328 Len=0"
"173","42.463584","142.250.76.42","192.168.0.175","TLSv1.3","1484","Server Hello, Change Cipher Spec"
"174","42.463630","142.250.76.42","192.168.0.175","TCP","1484","443  >  53868 [ACK] Seq=1431 Ack=518 Win=66816 Len=1430 [TCP segment of a reassembled PDU]"
"175","42.463630","142.250.76.42","192.168.0.175","TLSv1.3","110","Application Data"
"176","42.463664","192.168.0.175","142.250.76.42","TCP","54","53868  >  443 [ACK] Seq=518 Ack=2917 Win=131328 Len=0"
"177","42.463816","172.217.163.165","192.168.0.175","TLSv1.3","1484","Server Hello, Change Cipher Spec"
"178","42.464035","172.217.163.165","192.168.0.175","TLSv1.3","1258","Application Data"
"179","42.464035","142.250.67.78","192.168.0.175","TLSv1.3","1484","Server Hello, Change Cipher Spec"
"180","42.464099","192.168.0.175","172.217.163.165","TCP","54","53869  >  443 [ACK] Seq=518 Ack=2635 Win=131328 Len=0"
"181","42.464249","142.250.67.78","192.168.0.175","TCP","1484","443  >  53865 [ACK] Seq=1431 Ack=518 Win=66816 Len=1430 [TCP segment of a reassembled PDU]"
"182","42.464249","142.250.67.78","192.168.0.175","TLSv1.3","1018","Application Data"
"183","42.464298","192.168.0.175","142.250.67.78","TCP","54","53865  >  443 [ACK] Seq=518 Ack=3825 Win=131328 Len=0"
"184","42.464478","172.217.163.165","192.168.0.175","TLSv1.3","1484","Server Hello, Change Cipher Spec"
"185","42.464478","172.217.163.165","192.168.0.175","TLSv1.3","1259","Application Data"
"186","42.464527","192.168.0.175","172.217.163.165","TCP","54","53867  >  443 [ACK] Seq=518 Ack=2636 Win=131328 Len=0"
"187","42.502626","192.168.0.175","172.217.163.163","TLSv1.3","118","Change Cipher Spec, Application Data"
"188","42.504008","192.168.0.175","216.58.200.141","TLSv1.3","118","Change Cipher Spec, Application Data"
"189","42.505145","192.168.0.175","142.250.71.4","TLSv1.3","118","Change Cipher Spec, Application Data"
"190","42.506186","192.168.0.175","142.250.71.4","TLSv1.3","118","Change Cipher Spec, Application Data"
"191","42.506566","192.168.0.175","172.217.163.163","TLSv1.3","146","Application Data"
"192","42.506812","192.168.0.175","216.58.200.141","TLSv1.3","146","Application Data"
"193","42.507239","192.168.0.175","142.250.71.4","TLSv1.3","146","Application Data"
"194","42.507724","192.168.0.175","172.217.163.163","TLSv1.3","361","Application Data"
"195","42.508102","192.168.0.175","216.58.200.141","TCP","1484","53866  >  443 [ACK] Seq=674 Ack=2666 Win=131328 Len=1430 [TCP segment of a reassembled PDU]"
"196","42.508102","192.168.0.175","216.58.200.141","TLSv1.3","610","Application Data"
"197","42.508241","192.168.0.175","216.58.200.141","TLSv1.3","86","Application Data"
"198","42.508520","192.168.0.175","142.250.71.4","TLSv1.3","942","Application Data"
"199","42.508616","192.168.0.175","142.250.71.4","TLSv1.3","132","Application Data"
"200","42.508695","192.168.0.175","142.250.71.4","TLSv1.3","122","Application Data"
"201","42.509631","192.168.0.175","142.250.76.42","TLSv1.3","118","Change Cipher Spec, Application Data"
"202","42.510538","192.168.0.175","172.217.163.165","TLSv1.3","118","Change Cipher Spec, Application Data"
"203","42.511424","192.168.0.175","172.217.163.165","TLSv1.3","118","Change Cipher Spec, Application Data"
"204","42.512306","192.168.0.175","142.250.67.78","TLSv1.3","118","Change Cipher Spec, Application Data"
"205","42.512469","192.168.0.175","172.217.163.165","TCP","54","53867  >  443 [FIN, ACK] Seq=582 Ack=2636 Win=131328 Len=0"
"206","42.512628","192.168.0.175","142.250.76.42","TLSv1.3","146","Application Data"
"207","42.512748","192.168.0.175","172.217.163.165","TLSv1.3","146","Application Data"
"208","42.512923","192.168.0.175","142.250.67.78","TLSv1.3","146","Application Data"
"209","42.513182","192.168.0.175","142.250.76.42","TLSv1.3","321","Application Data"
"210","42.513249","192.168.0.175","142.250.76.42","TLSv1.3","364","Application Data"
"211","42.513367","192.168.0.175","172.217.163.165","TLSv1.3","414","Application Data"
"212","42.513484","192.168.0.175","142.250.67.78","TLSv1.3","563","Application Data"
"213","42.514206","172.217.163.163","192.168.0.175","TLSv1.3","634","Application Data, Application Data"
"214","42.514532","192.168.0.175","172.217.163.163","TLSv1.3","85","Application Data"
"215","42.515984","216.58.200.141","192.168.0.175","TLSv1.3","634","Application Data, Application Data"
"216","42.516248","192.168.0.175","216.58.200.141","TLSv1.3","85","Application Data"
"217","42.517825","216.58.200.141","192.168.0.175","TLSv1.3","85","Application Data"
"218","42.517825","172.217.163.163","192.168.0.175","TLSv1.3","85","Application Data"
"219","42.517907","142.250.71.4","192.168.0.175","TCP","54","443  >  53862 [ACK] Seq=2633 Ack=674 Win=66816 Len=0"
"220","42.517907","142.250.71.4","192.168.0.175","TLSv1.3","634","Application Data, Application Data"
"221","42.518047","142.250.71.4","192.168.0.175","TLSv1.3","85","Application Data"
"222","42.518085","192.168.0.175","142.250.71.4","TCP","54","53862  >  443 [ACK] Seq=1708 Ack=3244 Win=130816 Len=0"
"223","42.518182","192.168.0.175","142.250.71.4","TLSv1.3","85","Application Data"
"224","42.519376","216.58.200.141","192.168.0.175","TCP","56","443  >  53866 [ACK] Seq=3277 Ack=2660 Win=72448 Len=0"
"225","42.519560","142.250.71.4","192.168.0.175","TCP","56","443  >  53862 [ACK] Seq=3244 Ack=1640 Win=68608 Len=0"
"226","42.521081","142.250.76.42","192.168.0.175","TLSv1.3","634","Application Data, Application Data"
"227","42.521081","142.250.71.4","192.168.0.175","TCP","54","443  >  53863 [ACK] Seq=2632 Ack=582 Win=66816 Len=0"
"228","42.521390","192.168.0.175","142.250.76.42","TLSv1.3","85","Application Data"
"229","42.522066","172.217.163.165","192.168.0.175","TLSv1.3","634","Application Data, Application Data"
"230","42.523071","172.217.163.165","192.168.0.175","TLSv1.3","634","Application Data, Application Data"
"231","42.523071","142.250.76.42","192.168.0.175","TLSv1.3","85","Application Data"
"232","42.523164","192.168.0.175","172.217.163.165","TCP","54","53867  >  443 [RST, ACK] Seq=583 Ack=3216 Win=0 Len=0"
"233","42.523307","172.217.163.165","192.168.0.175","TCP","54","443  >  53867 [FIN, ACK] Seq=3216 Ack=583 Win=66816 Len=0"
"234","42.523307","172.217.163.163","192.168.0.175","TCP","54","443  >  53864 [ACK] Seq=3531 Ack=981 Win=67840 Len=0"
"235","42.523502","142.250.67.78","192.168.0.175","TLSv1.3","634","Application Data, Application Data"
"236","42.523502","142.250.67.78","192.168.0.175","TLSv1.3","85","Application Data"
"237","42.523588","192.168.0.175","142.250.67.78","TCP","54","53865  >  443 [ACK] Seq=1183 Ack=4436 Win=130816 Len=0"
"238","42.523714","142.250.76.42","192.168.0.175","TCP","56","443  >  53868 [ACK] Seq=3528 Ack=1251 Win=68864 Len=0"
"239","42.523714","142.250.71.4","192.168.0.175","TCP","56","443  >  53862 [ACK] Seq=3244 Ack=1708 Win=68608 Len=0"
"240","42.523907","216.58.200.141","192.168.0.175","TCP","56","443  >  53866 [ACK] Seq=3277 Ack=2692 Win=72448 Len=0"
"241","42.523907","172.217.163.165","192.168.0.175","TLSv1.3","85","Application Data"
"242","42.523973","192.168.0.175","172.217.163.165","TCP","54","53869  >  443 [ACK] Seq=1034 Ack=3246 Win=130816 Len=0"
"243","42.524533","192.168.0.175","172.217.163.165","TLSv1.3","85","Application Data"
"244","42.524644","192.168.0.175","142.250.67.78","TLSv1.3","85","Application Data"
"245","42.525453","172.217.163.165","192.168.0.175","TLSv1.3","268","Application Data"
"246","42.525453","172.217.163.165","192.168.0.175","TLSv1.3","311","Application Data"
"247","42.525540","192.168.0.175","172.217.163.165","TCP","54","53869  >  443 [ACK] Seq=1065 Ack=3717 Win=130304 Len=0"
"248","42.525595","172.217.163.165","192.168.0.175","TLSv1.3","93","Application Data"
"249","42.525595","172.217.163.163","192.168.0.175","TCP","56","443  >  53864 [ACK] Seq=3531 Ack=1012 Win=67840 Len=0"
"250","42.526003","192.168.0.175","172.217.163.165","TLSv1.3","93","Application Data"
"251","42.527015","216.58.200.141","192.168.0.175","TCP","56","443  >  53866 [ACK] Seq=3277 Ack=2723 Win=72448 Len=0"
"252","42.529820","192.168.0.175","142.250.71.4","TLSv1.3","551","Application Data"
"253","42.530167","142.250.71.4","192.168.0.175","TCP","56","443  >  53862 [ACK] Seq=3244 Ack=1739 Win=68608 Len=0"
"254","42.530167","142.250.67.78","192.168.0.175","TCP","56","443  >  53865 [ACK] Seq=4436 Ack=1183 Win=67840 Len=0"
"255","42.535665","142.250.67.78","192.168.0.175","TCP","56","443  >  53865 [ACK] Seq=4436 Ack=1214 Win=67840 Len=0"
"256","42.537124","172.217.163.165","192.168.0.175","TCP","56","443  >  53869 [ACK] Seq=3756 Ack=1104 Win=67840 Len=0"
"257","42.537124","142.250.76.42","192.168.0.175","TCP","56","443  >  53868 [ACK] Seq=3528 Ack=1282 Win=68864 Len=0"
"258","42.540942","142.250.71.4","192.168.0.175","TCP","56","443  >  53862 [ACK] Seq=3244 Ack=2236 Win=70400 Len=0"
"259","42.571286","142.250.71.4","192.168.0.175","TLSv1.3","603","Application Data"
"260","42.571286","142.250.71.4","192.168.0.175","TLSv1.3","139","Application Data, Application Data"
"261","42.571353","192.168.0.175","142.250.71.4","TCP","54","53862  >  443 [ACK] Seq=2236 Ack=3878 Win=130304 Len=0"
"262","42.571412","142.250.71.4","192.168.0.175","TLSv1.3","93","Application Data"
"263","42.571834","192.168.0.175","142.250.71.4","TLSv1.3","93","Application Data"
"264","42.572048","192.168.0.175","216.58.200.141","TCP","54","53866  >  443 [ACK] Seq=2723 Ack=3277 Win=130816 Len=0"
"265","42.572049","192.168.0.175","172.217.163.163","TCP","54","53864  >  443 [ACK] Seq=1012 Ack=3531 Win=130816 Len=0"
"266","42.572118","192.168.0.175","142.250.76.42","TCP","54","53868  >  443 [ACK] Seq=1282 Ack=3528 Win=130816 Len=0"
"267","42.574529","142.250.76.42","192.168.0.175","TLSv1.3","470","Application Data"
"268","42.574529","142.250.76.42","192.168.0.175","TLSv1.3","677","Application Data"
"269","42.574598","192.168.0.175","142.250.76.42","TCP","54","53868  >  443 [ACK] Seq=1282 Ack=4567 Win=131328 Len=0"
"270","42.574659","142.250.76.42","192.168.0.175","TLSv1.3","161","Application Data"
"271","42.574659","142.250.76.42","192.168.0.175","TLSv1.3","93","Application Data"
"272","42.574685","192.168.0.175","142.250.76.42","TCP","54","53868  >  443 [ACK] Seq=1282 Ack=4713 Win=131328 Len=0"
"273","42.575553","192.168.0.175","142.250.76.42","TLSv1.3","93","Application Data"
"274","42.575851","142.250.71.4","192.168.0.175","TLSv1.3","170","Application Data"
"275","42.575851","142.250.71.4","192.168.0.175","TLSv1.3","311","Application Data"
"276","42.575926","192.168.0.175","142.250.71.4","TCP","54","53862  >  443 [ACK] Seq=2275 Ack=4290 Win=131328 Len=0"
"277","42.575989","142.250.71.4","192.168.0.175","TLSv1.3","85","Application Data"
"278","42.578259","192.168.0.175","106.51.113.2","DNS","79","Standard query 0xcad6 A clients4.google.com"
"279","42.581075","106.51.113.2","192.168.0.175","DNS","119","Standard query response 0xcad6 A clients4.google.com CNAME clients.l.google.com A 142.250.67.78"
"280","42.582274","192.168.0.175","142.250.67.78","TLSv1.3","635","Application Data"
"281","42.582366","192.168.0.175","142.250.67.78","TLSv1.3","422","Application Data"
"282","42.583926","142.250.71.4","192.168.0.175","TLSv1.3","289","Application Data"
"283","42.583926","142.250.71.4","192.168.0.175","TLSv1.3","149","Application Data, Application Data"
"284","42.584029","192.168.0.175","142.250.71.4","TCP","54","53862  >  443 [ACK] Seq=2275 Ack=4651 Win=131072 Len=0"
"285","42.584205","142.250.71.4","192.168.0.175","TLSv1.3","93","Application Data"
"286","42.584250","192.168.0.175","142.250.71.4","TCP","54","53862  >  443 [ACK] Seq=2275 Ack=4690 Win=131072 Len=0"
"287","42.584914","192.168.0.175","142.250.71.4","TLSv1.3","93","Application Data"
"288","42.586411","142.250.76.42","192.168.0.175","TCP","56","443  >  53868 [ACK] Seq=4713 Ack=1321 Win=68864 Len=0"
"289","42.593553","142.250.67.78","192.168.0.175","TCP","56","443  >  53865 [ACK] Seq=4436 Ack=1795 Win=68864 Len=0"
"290","42.593553","142.250.67.78","192.168.0.175","TCP","56","443  >  53865 [ACK] Seq=4436 Ack=2163 Win=70144 Len=0"
"291","42.601837","142.250.71.4","192.168.0.175","TCP","56","443  >  53862 [ACK] Seq=4690 Ack=2314 Win=70400 Len=0"
"292","42.606413","142.250.71.4","192.168.0.175","TLSv1.3","293","Application Data"
"293","42.606413","142.250.71.4","192.168.0.175","TLSv1.3","1484","Application Data"
"294","42.606487","192.168.0.175","142.250.71.4","TCP","54","53862  >  443 [ACK] Seq=2314 Ack=6359 Win=131328 Len=0"
"295","42.606593","142.250.71.4","192.168.0.175","TLSv1.3","1484","Application Data"
"296","42.606593","142.250.71.4","192.168.0.175","TLSv1.3","1484","Application Data"
"297","42.606632","192.168.0.175","142.250.71.4","TCP","54","53862  >  443 [ACK] Seq=2314 Ack=9219 Win=131328 Len=0"
"298","42.606814","142.250.71.4","192.168.0.175","TLSv1.3","1484","Application Data"
"299","42.606814","142.250.71.4","192.168.0.175","TLSv1.3","146","Application Data"
"300","42.606863","192.168.0.175","142.250.71.4","TCP","54","53862  >  443 [ACK] Seq=2314 Ack=10741 Win=131328 Len=0"
"301","42.610307","142.250.71.4","192.168.0.175","TLSv1.3","1484","Application Data"
"302","42.610307","142.250.71.4","192.168.0.175","TLSv1.3","1484","Application Data"
"303","42.610396","192.168.0.175","142.250.71.4","TCP","54","53862  >  443 [ACK] Seq=2314 Ack=13601 Win=131328 Len=0"
"304","42.610467","142.250.71.4","192.168.0.175","TLSv1.3","1484","Application Data"
"305","42.611077","142.250.71.4","192.168.0.175","TLSv1.3","1484","Application Data"
"306","42.611077","142.250.71.4","192.168.0.175","TLSv1.3","1484","Application Data"
"307","42.611142","192.168.0.175","142.250.71.4","TCP","54","53862  >  443 [ACK] Seq=2314 Ack=17891 Win=131328 Len=0"
"308","42.611306","142.250.71.4","192.168.0.175","TLSv1.3","1484","Application Data"
"309","42.611358","192.168.0.175","142.250.71.4","TCP","54","53862  >  443 [ACK] Seq=2314 Ack=19321 Win=131328 Len=0"
"310","42.611498","142.250.71.4","192.168.0.175","TLSv1.3","1484","Application Data"
"311","42.612967","142.250.71.4","192.168.0.175","TLSv1.3","1484","Application Data"
"312","42.612967","142.250.71.4","192.168.0.175","TLSv1.3","1484","Application Data"
"313","42.613022","192.168.0.175","142.250.71.4","TCP","54","53862  >  443 [ACK] Seq=2314 Ack=23611 Win=131328 Len=0"
"314","42.613189","142.250.71.4","192.168.0.175","TLSv1.3","1484","Application Data"
"315","42.613229","192.168.0.175","142.250.71.4","TCP","54","53862  >  443 [ACK] Seq=2314 Ack=25041 Win=131328 Len=0"
"316","42.613417","142.250.71.4","192.168.0.175","TLSv1.3","1484","Application Data"
"317","42.614047","142.250.71.4","192.168.0.175","TLSv1.3","981","Application Data"
"318","42.614096","192.168.0.175","142.250.71.4","TCP","54","53862  >  443 [ACK] Seq=2314 Ack=27398 Win=131328 Len=0"
"319","42.615421","142.250.71.4","192.168.0.175","TLSv1.3","1484","Application Data"
"320","42.615421","142.250.71.4","192.168.0.175","TLSv1.3","1484","Application Data"
"321","42.615522","192.168.0.175","142.250.71.4","TCP","54","53862  >  443 [ACK] Seq=2314 Ack=30258 Win=131328 Len=0"
"322","42.615595","142.250.71.4","192.168.0.175","TLSv1.3","1484","Application Data"
"323","42.616172","142.250.71.4","192.168.0.175","TLSv1.3","1484","Application Data"
"324","42.616227","192.168.0.175","142.250.71.4","TCP","54","53862  >  443 [ACK] Seq=2314 Ack=33118 Win=131328 Len=0"
"325","42.616372","142.250.71.4","192.168.0.175","TLSv1.3","1484","Application Data"
"326","42.616622","142.250.71.4","192.168.0.175","TLSv1.3","1484","Application Data"
"327","42.616686","192.168.0.175","142.250.71.4","TCP","54","53862  >  443 [ACK] Seq=2314 Ack=35978 Win=131328 Len=0"
"328","42.618909","142.250.71.4","192.168.0.175","TLSv1.3","1484","Application Data"
"329","42.619075","142.250.71.4","192.168.0.175","TLSv1.3","1484","Application Data"
"330","42.619075","142.250.71.4","192.168.0.175","TLSv1.3","1484","Application Data"
"331","42.619142","192.168.0.175","142.250.71.4","TCP","54","53862  >  443 [ACK] Seq=2314 Ack=40268 Win=131328 Len=0"
"332","42.619222","142.250.71.4","192.168.0.175","TLSv1.3","1484","Application Data"
"333","42.619262","192.168.0.175","142.250.71.4","TCP","54","53862  >  443 [ACK] Seq=2314 Ack=41698 Win=131328 Len=0"
"334","42.619300","142.250.71.4","192.168.0.175","TLSv1.3","1484","Application Data"
"335","42.619519","142.250.71.4","192.168.0.175","TLSv1.3","1484","Application Data"
"336","42.619519","142.250.71.4","192.168.0.175","TLSv1.3","1484","Application Data [TCP segment of a reassembled PDU]"
"337","42.619558","192.168.0.175","142.250.71.4","TCP","54","53862  >  443 [ACK] Seq=2314 Ack=45988 Win=131328 Len=0"
"338","42.619594","142.250.71.4","192.168.0.175","TLSv1.3","1484","Application Data [TCP segment of a reassembled PDU]"
"339","42.619620","192.168.0.175","142.250.71.4","TCP","54","53862  >  443 [ACK] Seq=2314 Ack=47418 Win=131328 Len=0"
"340","42.619759","142.250.71.4","192.168.0.175","TLSv1.3","1484","Application Data [TCP segment of a reassembled PDU]"
"341","42.619998","142.250.71.4","192.168.0.175","TLSv1.3","1093","Application Data, Application Data, Application Data, Application Data"
"342","42.620052","192.168.0.175","142.250.71.4","TCP","54","53862  >  443 [ACK] Seq=2314 Ack=49887 Win=131328 Len=0"
"343","42.620224","192.168.0.175","142.250.71.4","TLSv1.3","93","Application Data"
"344","42.635653","142.250.71.4","192.168.0.175","TCP","56","443  >  53862 [ACK] Seq=49887 Ack=2353 Win=70400 Len=0"
"345","42.720712","172.217.163.163","192.168.0.175","TLSv1.3","318","Application Data"
"346","42.721986","172.217.163.163","192.168.0.175","TLSv1.3","85","Application Data"
"347","42.721986","172.217.163.163","192.168.0.175","TLSv1.3","93","Application Data"
"348","42.722070","192.168.0.175","172.217.163.163","TCP","54","53864  >  443 [ACK] Seq=1012 Ack=3865 Win=130560 Len=0"
"349","42.722471","192.168.0.175","172.217.163.163","TLSv1.3","93","Application Data"
"350","42.733969","172.217.163.163","192.168.0.175","TCP","56","443  >  53864 [ACK] Seq=3865 Ack=1051 Win=67840 Len=0"
"351","42.784687","142.250.67.78","192.168.0.175","TLSv1.3","633","Application Data"
"352","42.787065","142.250.67.78","192.168.0.175","TLSv1.3","574","Application Data"
"353","42.787141","192.168.0.175","142.250.67.78","TCP","54","53865  >  443 [ACK] Seq=2163 Ack=5535 Win=131328 Len=0"
"354","42.788172","142.250.67.78","192.168.0.175","TLSv1.3","338","Application Data"
"355","42.788172","142.250.67.78","192.168.0.175","TLSv1.3","93","Application Data"
"356","42.788267","192.168.0.175","142.250.67.78","TCP","54","53865  >  443 [ACK] Seq=2163 Ack=5858 Win=131072 Len=0"
"357","42.789579","192.168.0.175","142.250.67.78","TLSv1.3","93","Application Data"
"358","42.800877","142.250.67.78","192.168.0.175","TCP","56","443  >  53865 [ACK] Seq=5858 Ack=2202 Win=70144 Len=0"
"359","42.883997","142.250.67.78","192.168.0.175","TLSv1.3","224","Application Data"
"360","42.884997","142.250.67.78","192.168.0.175","TLSv1.3","556","Application Data"
"361","42.885076","192.168.0.175","142.250.67.78","TCP","54","53865  >  443 [ACK] Seq=2202 Ack=6530 Win=130560 Len=0"
"362","42.885653","142.250.67.78","192.168.0.175","TLSv1.3","278","Application Data"
"363","42.885653","142.250.67.78","192.168.0.175","TLSv1.3","249","Application Data"
"364","42.885653","142.250.67.78","192.168.0.175","TLSv1.3","93","Application Data"
"365","42.885744","192.168.0.175","142.250.67.78","TCP","54","53865  >  443 [ACK] Seq=2202 Ack=6988 Win=131328 Len=0"
"366","42.886943","192.168.0.175","142.250.67.78","TLSv1.3","93","Application Data"
"367","42.898674","142.250.67.78","192.168.0.175","TCP","56","443  >  53865 [ACK] Seq=6988 Ack=2241 Win=70144 Len=0"
"368","42.900261","192.168.0.175","192.168.0.255","NBNS","92","Name query NB WPAD<00>"
"369","42.900422","192.168.0.175","192.168.0.255","NBNS","92","Name query NB WPAD<00>"
"370","42.945535","216.58.200.141","192.168.0.175","TLSv1.3","1117","Application Data"
"371","42.945535","216.58.200.141","192.168.0.175","TLSv1.3","514","Application Data, Application Data"
"372","42.945535","216.58.200.141","192.168.0.175","TLSv1.3","140","Application Data"
"373","42.945535","216.58.200.141","192.168.0.175","TLSv1.3","93","Application Data"
